{"$schema":"https://json-schema.org/draft/2020-12/schema","$id":"adjudication.schema.json","title":"adjudication","type":"object","additionalProperties":false,"required":["schema_version","packet_id","gate_status","promotion_eligible","requires_human_review","disagreements","rationale"],"properties":{"schema_version":{"const":"1.0"},"packet_id":{"type":"string"},"gate_status":{"enum":["PASS","PARTIAL","FAIL","BLOCKED","N/A"]},"promotion_eligible":{"type":"boolean"},"requires_human_review":{"type":"boolean"},"disagreements":{"type":"array"},"rationale":{"type":"array","items":{"type":"string"}},"prior_project_status":{"type":"string"}}}